{
  "$ref": "#/definitions/subprocesses",
  "definitions": {
    "subprocesses": {
      "type": "object",
      "properties": {
        "title": {
          "type": "string"
        },
        "description": {
          "type": "string"
        },
        "tags": {
          "type": "array",
          "items": {
            "type": "string"
          }
        },
        "complexity": {
          "type": "string",
          "enum": [
            "low",
            "mid",
            "high"
          ]
        },
        "author": {
          "type": "string"
        },
        "discussionId": {
          "type": "number"
        },
        "published": {
          "anyOf": [
            {
              "type": "string",
              "format": "date-time"
            },
            {
              "type": "string",
              "format": "date"
            },
            {
              "type": "integer",
              "format": "unix-time"
            }
          ]
        },
        "$schema": {
          "type": "string"
        }
      },
      "required": [
        "title",
        "description",
        "tags",
        "complexity",
        "author",
        "published"
      ],
      "additionalProperties": false
    }
  },
  "$schema": "http://json-schema.org/draft-07/schema#"
}