{
  "title": "Employee Onboarding Process",
  "description": "Comprehensive onboarding workflow for new employees including documentation, IT setup, and orientation scheduling",
  "tags": ["hr", "onboarding", "workflow", "automation"],
  "complexity": "mid",
  "author": "subprocess-hub",
  "published": "2024-01-20"
}
